{
  "$schema": "https://json-schema.org/draft/2020-12/schema",
  "$id": "https://cupel.dev/schemas/cupel-spec-1/input.schema.json",
  "title": "Cupel engine input (cupel-spec/1)",
  "description": "What collectors and importers hand the engine. See spec/SPEC.md section 3.",
  "type": "object",
  "required": ["spec", "kind", "runtime", "sources", "tests", "coverage"],
  "additionalProperties": false,
  "properties": {
    "spec": { "$ref": "#/$defs/specVersion" },
    "kind": { "const": "input" },
    "runtime": {
      "type": "object",
      "required": ["name", "version"],
      "additionalProperties": false,
      "properties": {
        "name": { "type": "string", "minLength": 1 },
        "version": { "type": "string", "minLength": 1 }
      }
    },
    "runtimes": {
      "type": "array",
      "minItems": 1,
      "items": {
        "type": "object",
        "required": ["runner", "name", "version"],
        "additionalProperties": false,
        "properties": {
          "runner": { "type": "string", "minLength": 1 },
          "name": { "type": "string", "minLength": 1 },
          "version": { "type": "string", "minLength": 1 }
        }
      }
    },
    "collection": {
      "type": "object",
      "required": ["runs"],
      "additionalProperties": false,
      "properties": {
        "runs": { "type": "integer", "minimum": 1 },
        "config": { "$ref": "#/$defs/sha256" },
        "commit": { "type": "string", "pattern": "^[0-9a-f]{40,64}$" },
        "shard": {
          "type": "object",
          "required": ["index", "total", "suite", "files"],
          "additionalProperties": false,
          "properties": {
            "index": { "type": "integer", "minimum": 1 },
            "total": { "type": "integer", "minimum": 1 },
            "suite": { "$ref": "#/$defs/sha256" },
            "files": { "type": "object", "additionalProperties": { "$ref": "#/$defs/sha256" } }
          }
        },
        "subset": {
          "type": "object",
          "required": ["files"],
          "additionalProperties": false,
          "properties": { "files": { "type": "object", "additionalProperties": { "$ref": "#/$defs/sha256" } } }
        }
      }
    },
    "sources": {
      "type": "object",
      "additionalProperties": {
        "type": "object",
        "required": ["coverable"],
        "additionalProperties": false,
        "properties": {
          "coverable": { "$ref": "#/$defs/lineSet" },
          "hash": { "type": "string", "minLength": 1 }
        }
      }
    },
    "tests": {
      "type": "array",
      "items": {
        "type": "object",
        "required": ["id", "file", "name", "status"],
        "additionalProperties": false,
        "properties": {
          "id": { "type": "string", "minLength": 1 },
          "file": { "type": "string", "minLength": 1 },
          "name": { "type": "string" },
          "unit": { "type": "string", "minLength": 1 },
          "tags": { "type": "array", "items": { "type": "string", "minLength": 1 } },
          "status": { "enum": ["passed", "failed", "skipped"] },
          "runStatuses": { "type": "array", "minItems": 1, "items": { "enum": ["passed", "failed", "skipped"] } },
          "durationsMs": { "type": "array", "items": { "type": "integer", "minimum": 0 } },
          "kind": { "enum": ["unit", "e2e"] },
          "runner": { "type": "string", "minLength": 1 },
          "spawnsInterpreter": { "type": "boolean" }
        }
      }
    },
    "coverage": {
      "type": "object",
      "required": ["granularity"],
      "additionalProperties": false,
      "properties": {
        "granularity": { "enum": ["test", "file"] },
        "byTest": { "type": "object", "additionalProperties": { "$ref": "#/$defs/linesBySource" } },
        "byFile": { "type": "object", "additionalProperties": { "$ref": "#/$defs/linesBySource" } },
        "setup": { "type": "object", "additionalProperties": { "$ref": "#/$defs/linesBySource" } },
        "rechecked": { "type": "array", "items": { "type": "string", "minLength": 1 } },
        "unstable": { "$ref": "#/$defs/linesBySource" }
      }
    },
    "mutation": {
      "type": "object",
      "required": ["mutants"],
      "additionalProperties": false,
      "properties": {
        "mutants": {
          "type": "array",
          "items": {
            "type": "object",
            "required": ["id", "source", "line", "operator", "status"],
            "additionalProperties": false,
            "properties": {
              "id": { "type": "string", "minLength": 1 },
              "source": { "type": "string", "minLength": 1 },
              "line": { "type": "integer", "minimum": 1 },
              "operator": { "type": "string", "minLength": 1 },
              "status": { "enum": ["killed", "survived", "timeout", "no-coverage", "error"] },
              "killedBy": { "type": "array", "items": { "type": "string", "minLength": 1 } }
            }
          }
        },
        "targeted": { "type": "array", "items": { "type": "string", "minLength": 1 } },
        "seed": { "type": "integer" },
        "sampled": { "type": "boolean" }
      }
    },
    "brittleness": {
      "type": "array",
      "items": {
        "type": "object",
        "required": ["test", "kind"],
        "additionalProperties": false,
        "properties": {
          "test": { "type": "string", "minLength": 1 },
          "kind": { "enum": ["source-text", "css-class", "doc-wording", "file-snapshot"] },
          "line": { "type": "integer", "minimum": 1 },
          "deliberate": { "type": "boolean" }
        }
      }
    },
    "shapes": {
      "type": "object",
      "additionalProperties": { "type": "array", "items": { "type": "integer", "minimum": 0, "maximum": 4294967295 } }
    },
    "functionSites": {
      "type": "array",
      "items": {
        "type": "object",
        "required": ["id", "source", "operator", "functionKey", "functionName", "startLine", "endLine", "variant"],
        "additionalProperties": false,
        "properties": {
          "id": { "type": "string", "minLength": 1 },
          "source": { "type": "string", "minLength": 1 },
          "operator": { "const": "body-replace" },
          "functionKey": { "type": "string", "minLength": 1 },
          "functionName": { "type": "string" },
          "startLine": { "type": "integer", "minimum": 1 },
          "endLine": { "type": "integer", "minimum": 1 },
          "variant": { "type": "integer", "minimum": 0, "maximum": 1 }
        }
      }
    }
  },
  "$defs": {
    "sha256": { "type": "string", "pattern": "^sha256:[0-9a-f]{64}$" },
    "specVersion": { "type": "string", "pattern": "^cupel-spec/1(\\.[0-9]+)?$" },
    "lineSet": { "type": "string", "pattern": "^([1-9][0-9]*(-[1-9][0-9]*)?(,[1-9][0-9]*(-[1-9][0-9]*)?)*)?$" },
    "linesBySource": { "type": "object", "additionalProperties": { "$ref": "#/$defs/lineSet" } }
  }
}
