{
  "spec": "cupel-spec/1",
  "kind": "input",
  "runtime": {
    "name": "node",
    "version": "22.23.3"
  },
  "runtimes": [
    {
      "runner": "vitest",
      "name": "node",
      "version": "22.23.3"
    },
    {
      "runner": "pytest",
      "name": "python",
      "version": "3.13.1"
    }
  ],
  "sources": {
    "src/a.mjs": {
      "coverable": "1-10",
      "hash": "ha"
    },
    "pkg/b.py": {
      "coverable": "1-10",
      "hash": "hb"
    }
  },
  "tests": [
    {
      "id": "tests/a.test.mjs::a",
      "file": "tests/a.test.mjs",
      "name": "a",
      "status": "passed",
      "runner": "vitest"
    },
    {
      "id": "tests/test_b.py::test_b",
      "file": "tests/test_b.py",
      "name": "test_b",
      "status": "passed",
      "runner": "cargo"
    }
  ],
  "coverage": {
    "granularity": "test",
    "byTest": {
      "tests/a.test.mjs::a": {
        "src/a.mjs": "1-4"
      },
      "tests/test_b.py::test_b": {
        "pkg/b.py": "1-3"
      }
    }
  }
}
