{
  "spec": "cupel-spec/1",
  "kind": "input",
  "runtime": { "name": "python", "version": "3.14.8" },
  "sources": {
    "src/math_ops.py": { "coverable": "1-2,5-6" }
  },
  "tests": [
    {
      "id": "tests/test_math.py::TestMath.test_adds [critical]",
      "file": "tests/test_math.py",
      "name": "TestMath.test_adds [critical]",
      "status": "passed",
      "runStatuses": ["passed"],
      "tags": ["critical"]
    },
    {
      "id": "tests/test_math.py::TestMath.test_doubles",
      "file": "tests/test_math.py",
      "name": "TestMath.test_doubles",
      "status": "passed",
      "runStatuses": ["passed"],
      "tags": []
    },
    {
      "id": "tests/test_math.py::TestMath.test_rejects_wrong_result",
      "file": "tests/test_math.py",
      "name": "TestMath.test_rejects_wrong_result",
      "status": "failed",
      "runStatuses": ["failed"],
      "tags": []
    },
    {
      "id": "tests/test_math.py::TestMath.test_skipped_example",
      "file": "tests/test_math.py",
      "name": "TestMath.test_skipped_example",
      "status": "skipped",
      "runStatuses": ["skipped"],
      "tags": []
    }
  ],
  "coverage": {
    "granularity": "test",
    "byTest": {
      "tests/test_math.py::TestMath.test_adds [critical]": {
        "src/math_ops.py": "2"
      },
      "tests/test_math.py::TestMath.test_doubles": {
        "src/math_ops.py": "6"
      },
      "tests/test_math.py::TestMath.test_rejects_wrong_result": {
        "src/math_ops.py": "2"
      },
      "tests/test_math.py::TestMath.test_skipped_example": {}
    },
    "setup": {
      "tests/test_math.py": { "src/math_ops.py": "1,5" }
    }
  }
}
